title,subjects,authors,publish-date
Learning multi-site harmonization of magnetic resonance images without traveling human phantoms,"['Biomedical engineering', 'Image processing', 'Imaging techniques']","['Siyuan Liu', 'Pew-Thian Yap']",2024-01-05
Machine learning assisted dual-functional nanophotonic sensor for organic pollutant detection and degradation in water,"['Environmental monitoring', 'Nanoscale materials']","['Junhu Zhou', 'Ziqian Wu', 'Congran Jin', 'John X. J. Zhang']",2024-01-16
Predicting state level suicide fatalities in the united states with realtime data and machine learning,"['Health services', 'Public health']","['Devashru Patel', 'Steven A. Sumner', 'Daniel Bowen', 'Marissa Zwald', 'Ellen Yard', 'Jing Wang', 'Royal Law', 'Kristin Holland', 'Theresa Nguyen', 'Gary Mower', 'Yushiuan Chen', 'Jenna Iberg Johnson', 'Megan Jespersen', 'Elizabeth Mytty', 'Jennifer M. Lee', 'Michael Bauer', 'Eric Caine', 'Munmun De Choudhury']",2024-01-16
Segment anything in medical images,"['Anatomy', 'Computer science', 'Machine learning', 'Medical imaging']","['Jun Ma', 'Yuting He', 'Feifei Li', 'Lin Han', 'Chenyu You', 'Bo Wang']",2024-01-22
Unlabeled data selection for active learning in image classification,"['Computer science', 'Information technology', 'Software']","['Xiongquan Li', 'Xukang Wang', 'Xuhesheng Chen', 'Yao Lu', 'Hongpeng Fu', 'Ying Cheng Wu']",2024-01-03
AI co-pilot bronchoscope robot,"['Biomedical engineering', 'Mechanical engineering', 'Physical examination']","['Jingyu Zhang', 'Lilu Liu', 'Pingyu Xiang', 'Qin Fang', 'Xiuping Nie', 'Honghai Ma', 'Jian Hu', 'Rong Xiong', 'Yue Wang', 'Haojian Lu']",2024-01-04
Identification of extracellular vesicles from their Raman spectra via self-supervised learning,"['Cellular microbiology', 'Endosomes', 'Nanoscale biophysics', 'Raman spectroscopy', 'Scientific data']","['Mathias N. Jensen', 'Eduarda M. Guerreiro', 'Agustin Enciso-Martinez', 'Sergei G. Kruglik', 'Cees Otto', 'Omri Snir', 'Benjamin Ricaud', 'Olav Gaute Hellesø']",2024-03-21
"EVATOM: an optical, label-free, machine learning assisted embryo health assessment tool","['Embryology', 'Machine learning', 'Optical imaging']","['Neha Goswami', 'Nicola Winston', 'Wonho Choi', 'Nastasia Z. E. Lai', 'Rachel B. Arcanjo', 'Xi Chen', 'Nahil Sobh', 'Romana A. Nowak', 'Mark A. Anastasio', 'Gabriel Popescu']",2024-03-05
Improving image classification of gastrointestinal endoscopy using curriculum self-supervised learning,"['Diagnosis', 'Endoscopy', 'Ulcers']","['Han Guo', 'Sai Ashish Somayajula', 'Ramtin Hosseini', 'Pengtao Xie']",2024-03-13
De novo antioxidant peptide design via machine learning and DFT studies,"['Medicinal chemistry', 'Organic chemistry', 'Peptides', 'Chemical synthesis', 'Theoretical chemistry', 'Antioxidant peptides', 'De novo design', 'Deep learning', 'Machine learning', 'DFT calculation', 'Molecular dynamics simulations']","['Parsa Hesamzadeh', 'Abdolvahab Seif', 'Kazem Mahmoudzadeh', 'Mokhtar Ganjali Koli', 'Amrollah Mostafazadeh', 'Kosar Nayeri', 'Zohreh Mirjafary', 'Hamid Saeidian']",2024-03-18
Towards a general-purpose foundation model for computational pathology,"['Biomedical engineering', 'Machine learning', 'Pathology']","['Richard J. Chen', 'Tong Ding', 'Ming Y. Lu', 'Drew F. K. Williamson', 'Guillaume Jaume', 'Andrew H. Song', 'Bowen Chen', 'Andrew Zhang', 'Daniel Shao', 'Muhammad Shaban', 'Mane Williams', 'Lukas Oldenburg', 'Luca L. Weishaupt', 'Judy J. Wang', 'Anurag Vaidya', 'Long Phi Le', 'Georg Gerber', 'Sharifa Sahai', 'Walt Williams', 'Faisal Mahmood']",2024-03-19
A framework for the facilitation of accelerated leadership and management capability development in the workplace,['Business and management'],"['Gregory J. Harper', 'Roslyn Cameron', 'Christine Edwards']",2024-03-06
Wildfire spreading prediction using multimodal data and deep neural network approach,"['Environmental sciences', 'Natural hazards']","['Dmitrii Shadrin', 'Svetlana Illarionova', 'Fedor Gubanov', 'Ksenia Evteeva', 'Maksim Mironenko', 'Ivan Levchunets', 'Roman Belousov', 'Evgeny Burnaev']",2024-01-31
Hybrid AI-enhanced lightning flash prediction in the medium-range forecast horizon,"['Atmospheric dynamics', 'Hydrology', 'Natural hazards']","['Mattia Cavaiola', 'Federico Cassola', 'Davide Sacchetti', 'Francesco Ferrari', 'Andrea Mazzino']",2024-02-08
TISSUE: uncertainty-calibrated prediction of single-cell spatial transcriptomics improves downstream analyses,"['Computational biology and bioinformatics', 'Transcriptomics']","['Eric D. Sun', 'Rong Ma', 'Paloma Navarro Negredo', 'Anne Brunet', 'James Zou']",2024-02-12
Local orchestration of distributed functional patterns supporting loss and restoration of consciousness in the primate brain,"['Consciousness', 'Dynamical systems', 'Network models']","['Andrea I. Luppi', 'Lynn Uhrig', 'Jordy Tasserie', 'Camilo M. Signorelli', 'Emmanuel A. Stamatakis', 'Alain Destexhe', 'Bechir Jarraya', 'Rodrigo Cofre']",2024-03-11
"MAIVeSS: streamlined selection of antigenically matched, high-yield viruses for seasonal influenza vaccine production","['Computational models', 'Influenza virus', 'Machine learning', 'Protein design', 'Vaccines']","['Cheng Gao', 'Feng Wen', 'Minhui Guan', 'Bijaya Hatuwal', 'Lei Li', 'Beatriz Praena', 'Cynthia Y. Tang', 'Jieze Zhang', 'Feng Luo', 'Hang Xie', 'Richard Webby', 'Yizhi Jane Tao', 'Xiu-Feng Wan']",2024-02-06
Uncovering drone intentions using control physics informed machine learning,"['Aerospace engineering', 'Computer science']","['Adolfo Perrusquía', 'Weisi Guo', 'Benjamin Fraser', 'Zhuangkun Wei']",2024-02-24
Machine learning and radiomics for segmentation and classification of adnexal masses on ultrasound,['Cancer imaging'],"['Jennifer F. Barcroft', 'Kristofer Linton-Reid', 'Chiara Landolfo', 'Maya Al-Memar', 'Nina Parker', 'Chris Kyriacou', 'Maria Munaretto', 'Martina Fantauzzi', 'Nina Cooper', 'Joseph Yazbek', 'Nishat Bharwani', 'Sa Ra Lee', 'Ju Hee Kim', 'Dirk Timmerman', 'Joram Posma', 'Luca Savelli', 'Srdjan Saso', 'Eric O. Aboagye', 'Tom Bourne']",2024-02-20
Digital health technologies and machine learning augment patient reported outcomes to remotely characterise rheumatoid arthritis,"['Chronic pain', 'Fatigue', 'Predictive markers', 'Rheumatoid arthritis', 'Translational research']","['Andrew P. Creagh', 'Valentin Hamy', 'Hang Yuan', 'Gert Mertes', 'Ryan Tomlinson', 'Wen-Hung Chen', 'Rachel Williams', 'Christopher Llop', 'Christopher Yee', 'Mei Sheng Duh', 'Aiden Doherty', 'Luis Garcia-Gancedo', 'David A. Clifton']",2024-02-12
Optimizing warfarin dosing for patients with atrial fibrillation using machine learning,"['Atrial fibrillation', 'Machine learning']","['Jeremy Petch', 'Walter Nelson', 'Mary Wu', 'Marzyeh Ghassemi', 'Alexander Benz', 'Mehdi Fatemi', 'Shuang Di', 'Anthony Carnicelli', 'Christopher Granger', 'Robert Giugliano', 'Hwanhee Hong', 'Manesh Patel', 'Lars Wallentin', 'John Eikelboom', 'Stuart J. Connolly']",2024-02-24
Functional and structural reorganization in brain tumors: a machine learning approach using desynchronized functional oscillations,"['Brain injuries', 'Cancer imaging', 'Neuroscience']","['Joan Falcó-Roget', 'Alberto Cacciola', 'Fabio Sambataro', 'Alessandro Crimi']",2024-04-06
The covariance environment defines cellular niches for spatial inference,['Computational models'],"['Doron Haviv', 'Ján Remšík', 'Mohamed Gatie', 'Catherine Snopkowski', 'Meril Takizawa', 'Nathan Pereira', 'John Bashkin', 'Stevan Jovanovich', 'Tal Nawy', 'Ronan Chaligne', 'Adrienne Boire', 'Anna-Katerina Hadjantonakis', 'Dana Pe’er']",2024-04-02
Prediction model for spinal cord injury in spinal tuberculosis patients using multiple machine learning algorithms: a multicentric study,"['Computational biology and bioinformatics', 'Machine learning', 'Microbiology', 'Predictive medicine', 'Spinal tuberculosis', 'Spinal cord injury', 'Machine learning', 'Predictive model', 'Model interpretation', 'Model deployment']","['Sitan Feng', 'Shujiang Wang', 'Chong Liu', 'Shaofeng Wu', 'Bin Zhang', 'Chunxian Lu', 'Chengqian Huang', 'Tianyou Chen', 'Chenxing Zhou', 'Jichong Zhu', 'Jiarui Chen', 'Jiang Xue', 'Wendi Wei', 'Xinli Zhan']",2024-04-02
Toward universal cell embeddings: integrating single-cell RNA-seq datasets across species with SATURN,"['Data integration', 'Evolution', 'Machine learning', 'Software', 'Transcriptomics']","['Yanay Rosen', 'Maria Brbić', 'Yusuf Roohani', 'Kyle Swanson', 'Ziang Li', 'Jure Leskovec']",2024-02-16
Data-driven normative values based on generative manifold learning for quantitative MRI,"['Diagnostic markers', 'Learning algorithms']","['Arnaud Attyé', 'Félix Renard', 'Vanina Anglade', 'Alexandre Krainik', 'Philippe Kahane', 'Boris Mansencal', 'Pierrick Coupé', 'Fernando Calamante']",2024-03-30
Variational autoencoder for design of synthetic viral vector serotypes,"['Gene therapy', 'Protein design']","['Suyue Lyu', 'Shahin Sowlati-Hashjin', 'Michael Garton']",2024-01-23
Geologically-constrained GANomaly network for mineral prospectivity mapping through frequency domain training data,"['Chemistry', 'Engineering', 'Environmental sciences', 'Mathematics and computing', 'Solid Earth sciences', 'Generative adversarial network', 'Geologically-constrained GANomaly', 'Multi-element geochemical anomaly', 'Mineral prospectivity mapping', 'Au–Cu mineralization', 'Frequency domain data']","['Hamid Sabbaghi', 'Seyed Hassan Tabatabaei', 'Nader Fathianpour']",2024-03-14
Interpretable detection of epiretinal membrane from optical coherence tomography with deep neural networks,"['Retinal diseases', 'Translational research']","['Murat Seçkin Ayhan', 'Jonas Neubauer', 'Mehmet Murat Uzel', 'Faik Gelisken', 'Philipp Berens']",2024-04-11
"Automated body organ segmentation, volumetry and population-averaged atlas for 3D motion-corrected T2-weighted fetal body MRI","['Biomedical engineering', 'Machine learning']","['Alena U. Uus', 'Megan Hall', 'Irina Grigorescu', 'Carla Avena Zampieri', 'Alexia Egloff Collado', 'Kelly Payette', 'Jacqueline Matthew', 'Vanessa Kyriakopoulou', 'Joseph V. Hajnal', 'Jana Hutter', 'Mary A. Rutherford', 'Maria Deprez', 'Lisa Story']",2024-03-19
The genetic architecture of multimodal human brain age,"['Genetics research', 'Machine learning', 'Predictive markers']","['Junhao Wen', 'Bingxin Zhao', 'Zhijian Yang', 'Guray Erus', 'Ioanna Skampardoni', 'Elizabeth Mamourian', 'Yuhan Cui', 'Gyujoon Hwang', 'Jingxuan Bao', 'Aleix Boquet-Pujadas', 'Zhen Zhou', 'Yogasudha Veturi', 'Marylyn D. Ritchie', 'Haochang Shou', 'Paul M. Thompson', 'Li Shen', 'Arthur W. Toga', 'Christos Davatzikos']",2024-03-23
Augmented drug combination dataset to improve the performance of machine learning models predicting synergistic anticancer effects,"['Computational biology and bioinformatics', 'Data processing', 'Machine learning']","['Mengmeng Liu', 'Gopal Srivastava', 'J. Ramanujam', 'Michal Brylinski']",2024-01-18
A ResNet-LSTM hybrid model for predicting epileptic seizures using a pretrained model with supervised contrastive learning,"['Diseases of the nervous system', 'Epilepsy', 'Neuroscience']","['Dohyun Lee', 'Byunghyun Kim', 'Taejoon Kim', 'Inwhee Joe', 'Jongwha Chong', 'Kyeongyuk Min', 'Kiyoung Jung']",2024-01-15
Dynamic network link prediction with node representation learning from graph convolutional networks,"['Computer science', 'Mathematics and computing']","['Peng Mei', 'Yu hong Zhao']",2024-01-04
Gamma oscillatory complexity conveys behavioral information in hippocampal networks,"['Hippocampus', 'Neural circuits']","['Vincent Douchamps', 'Matteo di Volo', 'Alessandro Torcini', 'Demian Battaglia', 'Romain Goutagny']",2024-02-29
An interpretable machine learning system for colorectal cancer diagnosis from pathology slides,"['Cancer imaging', 'Colorectal cancer']","['Pedro C. Neto', 'Diana Montezuma', 'Sara P. Oliveira', 'Domingos Oliveira', 'João Fraga', 'Ana Monteiro', 'João Monteiro', 'Liliana Ribeiro', 'Sofia Gonçalves', 'Stefan Reinhard', 'Inti Zlobec', 'Isabel M. Pinto', 'Jaime S. Cardoso']",2024-03-05
Long-term in vivo three-photon imaging reveals region-specific differences in healthy and regenerative oligodendrogenesis,"['Multiple sclerosis', 'Oligodendrocyte']","['Michael A. Thornton', 'Gregory L. Futia', 'Michael E. Stockton', 'Samuel A. Budoff', 'Alexandra N. Ramirez', 'Baris Ozbay', 'Omer Tzang', 'Karl Kilborn', 'Alon Poleg-Polsky', 'Diego Restrepo', 'Emily A. Gibson', 'Ethan G. Hughes']",2024-03-27
Integrating core physics and machine learning for improved parameter prediction in boiling water reactor operations,"['Engineering', 'Nuclear energy', 'Nuclear fusion and fission', 'Nuclear physics', 'Power stations', 'Nuclear reactor', 'Neural network', 'Neutron diffusion']","['M. R. Oktavian', 'J. Nistor', 'J. T. Gruenwald', 'Y. Xu']",2024-03-10
Predicting memorability of face photographs with deep neural networks,"['Computational models', 'Computer science', 'Human behaviour']","['Mohammad Younesi', 'Yalda Mohsenzadeh']",2024-01-13
Applying machine learning algorithms to predict the stock price trend in the stock market – The case of Vietnam,"['Business and management', 'Economics', 'Finance']","['Tran Phuoc', 'Pham Thi Kim Anh', 'Phan Huy Tam', 'Chien V. Nguyen']",2024-03-12
Prediction of plasma ctDNA fraction and prognostic implications of liquid biopsy in advanced prostate cancer,"['Cancer genomics', 'Machine learning', 'Predictive markers', 'Prognostic markers', 'Prostate cancer']","['Nicolette M. Fonseca', 'Corinne Maurice-Dror', 'Cameron Herberts', 'Wilson Tu', 'William Fan', 'Andrew J. Murtha', 'Catarina Kollmannsberger', 'Edmond M. Kwan', 'Karan Parekh', 'Elena Schönlau', 'Cecily Q. Bernales', 'Gráinne Donnellan', 'Sarah W. S. Ng', 'Takayuki Sumiyoshi', 'Joanna Vergidis', 'Krista Noonan', 'Daygen L. Finch', 'Muhammad Zulfiqar', 'Stacy Miller', 'Sunil Parimi', 'Jean-Michel Lavoie', 'Edward Hardy', 'Maryam Soleimani', 'Lucia Nappi', 'Bernhard J. Eigl', 'Christian Kollmannsberger', 'Sinja Taavitsainen', 'Matti Nykter', 'Sofie H. Tolmeijer', 'Emmy Boerrigter', 'Niven Mehra', 'Nielka P. van Erp', 'Bram De Laere', 'Johan Lindberg', 'Henrik Grönberg', 'Daniel J. Khalaf', 'Matti Annala', 'Kim N. Chi', 'Alexander W. Wyatt']",2024-02-28
Encoding of multi-modal emotional information via personalized skin-integrated wireless facial interface,"['Information technology', 'Polymers', 'Sensors and biosensors']","['Jin Pyo Lee', 'Hanhyeok Jang', 'Yeonwoo Jang', 'Hyeonseo Song', 'Suwoo Lee', 'Pooi See Lee', 'Jiyun Kim']",2024-01-15
Climate-induced tree-mortality pulses are obscured by broad-scale and long-term greening,"['Climate-change ecology', 'Climate-change impacts']","['Yuchao Yan', 'Shilong Piao', 'William M. Hammond', 'Anping Chen', 'Songbai Hong', 'Hao Xu', 'Seth M. Munson', 'Ranga B. Myneni', 'Craig D. Allen']",2024-03-11
Selective knowledge sharing for privacy-preserving federated distillation without a good teacher,"['Computer science', 'Electrical and electronic engineering', 'Technology']","['Jiawei Shao', 'Fangzhao Wu', 'Jun Zhang']",2024-01-08
Microstructure reconstruction of 2D/3D random materials via diffusion-based deep generative models,"['Composites', 'Computer science']","['Xianrui Lyu', 'Xiaodan Ren']",2024-02-29
Protein function prediction as approximate semantic entailment,"['Gene ontology', 'Machine learning', 'Protein function predictions']","['Maxat Kulmanov', 'Francisco J. Guzmán-Vega', 'Paula Duek Roggli', 'Lydie Lane', 'Stefan T. Arold', 'Robert Hoehndorf']",2024-02-14
Gamma power and beta envelope correlation are potential neural predictors of deep hypnosis,"['Cognitive neuroscience', 'Consciousness', 'Psychology', 'Hypnosis', 'EEG', 'Machine learning', 'Interpretable AI']","['Yeganeh Farahzadi', 'Cameron Alldredge', 'Zoltán Kekecs']",2024-03-15
Few-shot concealed object detection in sub-THz security images using improved pseudo-annotations,"['Computational science', 'Electrical and electronic engineering', 'Information technology', 'Scientific data']","['Ran Cheng', 'Stepan Lucyszyn']",2024-02-07
SCB-YOLOv5: a lightweight intelligent detection model for athletes’ normative movements,"['Engineering', 'Mathematics and computing', 'Digital sports', 'Action recognition', 'Deep learning', 'Attention module']","['Qing Du', 'Lian Tang', 'Ya Li']",2024-04-14
Gaussian Aquila optimizer based dual convolutional neural networks for identification and grading of osteoarthritis using knee joint images,"['Engineering', 'Health care', 'Knee-joint images', 'Osteoarthritis', 'Dual convolutional neural network', 'Gaussian mutation', 'Aquila optimizer', 'X-Ray images']","['B. Subha', 'Vijay Jeyakumar', 'S. N. Deepa']",2024-03-27
Generation of synthetic whole-slide image tiles of tumours from RNA-sequencing data via cascaded diffusion models,"['Cancer imaging', 'Computational models', 'Machine learning']","['Francisco Carrillo-Perez', 'Marija Pizurica', 'Yuanning Zheng', 'Tarak Nath Nandi', 'Ravi Madduri', 'Jeanne Shen', 'Olivier Gevaert']",2024-03-21
A predictive model for post-thoracoscopic surgery pulmonary complications based on the PBNN algorithm,"['Health care', 'Risk factors', 'LGBM', 'Machine learning', 'Deep learning', 'Prediction', 'PPCs']","['Cheng-Mao Zhou', 'Qiong Xue', 'HuiJuan Li', 'Jian-Jun Yang', 'Yu Zhu']",2024-03-25
A hippocampus-accumbens code guides goal-directed appetitive behavior,"['Hippocampus', 'Neural circuits', 'Reward', 'Spatial memory']","['Oliver Barnstedt', 'Petra Mocellin', 'Stefan Remy']",2024-04-12
Leveraging large language models for predictive chemistry,"['Chemistry', 'Computational science']","['Kevin Maik Jablonka', 'Philippe Schwaller', 'Andres Ortega-Guerrero', 'Berend Smit']",2024-02-06
Accelerating process development for 3D printing of new metal alloys,"['Computational methods', 'Design, synthesis and processing', 'Imaging techniques', 'Metals and alloys']","['David Guirguis', 'Conrad Tucker', 'Jack Beuth']",2024-01-17
Orbital angular momentum-mediated machine learning for high-accuracy mode-feature encoding,"['Applied optics', 'Optical techniques']","['Xinyuan Fang', 'Xiaonan Hu', 'Baoli Li', 'Hang Su', 'Ke Cheng', 'Haitao Luan', 'Min Gu']",2024-02-14
A hybrid machine learning-based model for predicting flight delay through aviation big data,"['Computational science', 'Computer science', 'Information technology', 'Machine learning', 'Big data', 'Aviation data', 'Flight delay prediction']",['Min Dai'],2024-02-26
Extracting interpretable features for pathologists using weakly supervised learning to predict p16 expression in oropharyngeal cancer,"['Cancer', 'Diagnostic markers', 'Head and neck cancer']","['Masahiro Adachi', 'Tetsuro Taki', 'Naoya Sakamoto', 'Motohiro Kojima', 'Akihiko Hirao', 'Kazuto Matsuura', 'Ryuichi Hayashi', 'Keiji Tabuchi', 'Shumpei Ishikawa', 'Genichiro Ishii', 'Shingo Sakashita']",2024-02-24
Optimizing skin disease diagnosis: harnessing online community data with contrastive learning and clustering techniques,"['Physical examination', 'Technology']","['Yue Shen', 'Huanyu Li', 'Can Sun', 'Hongtao Ji', 'Daojun Zhang', 'Kun Hu', 'Yiqi Tang', 'Yu Chen', 'Zikun Wei', 'Junwei Lv']",2024-02-08
Field-scale crop water consumption estimates reveal potential water savings in California agriculture,"['Environmental impact', 'Hydrology']","['Anna Boser', 'Kelly Caylor', 'Ashley Larsen', 'Madeleine Pascolini-Campbell', 'John T. Reager', 'Tamma Carleton']",2024-03-25
Response score-based protein structure analysis for cancer prediction aided by the Internet of Things,"['Cancer', 'Engineering', 'Physics']","['Omar Alruwaili', 'Amr Yousef', 'Touqeer A. Jumani', 'Ammar Armghan']",2024-01-28
AI-driven projection tomography with multicore fibre-optic cell rotation,"['Cellular imaging', 'Microscopy', 'Optical manipulation and tweezers']","['Jiawei Sun', 'Bin Yang', 'Nektarios Koukourakis', 'Jochen Guck', 'Juergen W. Czarske']",2024-01-02
High-speed and energy-efficient non-volatile silicon photonic memory based on heterogeneously integrated memresonator,"['Integrated optics', 'Optical data storage', 'Optoelectronic devices and components']","['Bassem Tossoun', 'Di Liang', 'Stanley Cheung', 'Zhuoran Fang', 'Xia Sheng', 'John Paul Strachan', 'Raymond G. Beausoleil']",2024-01-16
Cortical astrocyte N-methyl-D-aspartate receptors influence whisker barrel activity and sensory discrimination in mice,"['Astrocyte', 'Ion channels in the nervous system', 'Neural circuits', 'Sensory processing']","['Noushin Ahmadpour', 'Meher Kantroo', 'Michael J. Stobart', 'Jessica Meza-Resillas', 'Shahin Shabanipour', 'Jesus Parra-Nuñez', 'Tetiana Salamovska', 'Anna Muzaleva', 'Finnegan O’Hara', 'Dustin Erickson', 'Bruno Di Gaetano', 'Sofia Carrion-Falgarona', 'Bruno Weber', 'Alana Lamont', 'Natalie E. Lavine', 'Tiina M. Kauppinen', 'Michael F. Jackson', 'Jillian L. Stobart']",2024-02-21
Solving olympiad geometry without human demonstrations,"['Computational science', 'Computer science']","['Trieu H. Trinh', 'Yuhuai Wu', 'Quoc V. Le', 'He He', 'Thang Luong']",2024-01-17
MENDER: fast and scalable tissue structure identification in spatial omics data,"['Classification and taxonomy', 'Computational models', 'Data integration', 'RNA sequencing', 'Software']",['Zhiyuan Yuan'],2024-01-05
An analysis of case studies for advancing photovoltaic power forecasting through multi-scale fusion techniques,"['Energy science and technology', 'Engineering', 'Mathematics and computing', 'Time series forecasting', 'Photovoltaic', 'Deep learning', 'Hybrid methods', 'Signal processing']","['Mawloud Guermoui', 'Amor Fezzani', 'Zaiani Mohamed', 'Abdelaziz Rabehi', 'Khaled Ferkous', 'Nadjem Bailek', 'Sabrina Bouallit', 'Abdelkader Riche', 'Mohit Bajaj', 'Shir Ahmad Dost Mohammadi', 'Enas Ali', 'Sherif S. M. Ghoneim']",2024-03-20
MarsGT: Multi-omics analysis for rare population inference using single-cell graph transformer,"['Computational models', 'Gene regulatory networks', 'Genomics', 'Machine learning', 'RNA sequencing']","['Xiaoying Wang', 'Maoteng Duan', 'Jingxian Li', 'Anjun Ma', 'Gang Xin', 'Dong Xu', 'Zihai Li', 'Bingqiang Liu', 'Qin Ma']",2024-01-06
Predicting the complexity and mortality of polytrauma patients with machine learning models,"['Outcomes research', 'Prognosis', 'Trauma', 'Machine learning models', 'Polytrauma mortality', 'Polytrauma complexity']","['Meiqi Yu', 'Shen Wang', 'Kai He', 'Fei Teng', 'Jin Deng', 'Shuhang Guo', 'Xiaofeng Yin', 'Qingguo Lu', 'Wanjun Gu']",2024-04-09
"Optimizing PCF-SPR sensor design through Taguchi approach, machine learning, and genetic algorithms","['Optical physics', 'Optics and photonics', 'Genetic algorithm', 'Surface plasmon resonance', 'Photonic crystal fiber', 'Multi-layer perceptron', 'Particle swarm optimization', 'Taguchi approach']","['Sameh Kaziz', 'Fraj Echouchene', 'Mohamed Hichem Gazzah']",2024-04-03
Blocked training facilitates learning of multiple schemas,['Human behaviour'],"['Andre O. Beukers', 'Silvy H. P. Collin', 'Ross P. Kempner', 'Nicholas T. Franklin', 'Samuel J. Gershman', 'Kenneth A. Norman']",2024-04-09
Accurate machine learning force fields via experimental and simulation data fusion,"['Atomistic models', 'Computational methods']","['Sebastien Röcken', 'Julija Zavadlav']",2024-04-05
A machine learning approach for predicting radiation-induced hypothyroidism in patients with nasopharyngeal carcinoma undergoing tomotherapy,"['Cancer imaging', 'Head and neck cancer', 'Predictive markers', 'Tomotherapy', 'Hypothyroidism prediction', 'Radiomics', 'Dosiomics', 'Machine learning']","['Ke-Run Quan', 'Wen-Rong Lin', 'Jia-Biao Hong', 'Yu-Hao Lin', 'Kai-Qiang Chen', 'Ji-Hong Chen', 'Pin-Jing Cheng']",2024-04-10
A novel difficult-to-segment samples focusing network for oral CBCT image segmentation,"['Engineering', 'Mathematics and computing', 'Deep learning', 'Images segmentation', 'Medical image processing', 'Convolutional neural networks']","['Fengjun Hu', 'Zeyu Chen', 'Fan Wu']",2024-03-01
Visual interpretable MRI fine grading of meniscus injury for intelligent assisted diagnosis and treatment,"['Diagnosis', 'Diseases', 'Experimental models of disease']","['Anlin Luo', 'Shuiping Gou', 'Nuo Tong', 'Bo Liu', 'Licheng Jiao', 'Hu Xu', 'Yingchun Wang', 'Tan Ding']",2024-04-15
Remote sensing based forest cover classification using machine learning,"['Engineering', 'Environmental sciences']","['Gouhar Aziz', 'Nasru Minallah', 'Aamir Saeed', 'Jaroslav Frnda', 'Waleed Khan']",2024-01-02
Conditional generative learning for medical image imputation,"['Computational science', 'Preclinical research']","['Ragheb Raad', 'Deep Ray', 'Bino Varghese', 'Darryl Hwang', 'Inderbir Gill', 'Vinay Duddalwar', 'Assad A. Oberai']",2024-01-02
Interactive residual coordinate attention and contrastive learning for infrared and visible image fusion in triple frequency bands,"['Computer science', 'Information technology']","['Zhihua Xie', 'Sha Zong', 'Qiang Li', 'Peiqi Cai', 'Yaxiong Zhan', 'Guodong Liu']",2024-01-02
"Prediction of atmospheric PM2.5 level by machine learning techniques in Isfahan, Iran","['Climate sciences', 'Environmental sciences', 'Environmental social sciences', 'Mathematics and computing']","['Farzaneh Mohammadi', 'Hakimeh Teiri', 'Yaghoub Hajizadeh', 'Ali Abdolahnejad', 'Afshin Ebrahimi']",2024-01-24
Learning reservoir dynamics with temporal self-modulation,"['Applied mathematics', 'Computational science']","['Yusuke Sakemi', 'Sou Nobukawa', 'Toshitaka Matsuki', 'Takashi Morie', 'Kazuyuki Aihara']",2024-01-12
