title,subjects,authors,publish-date
"Multimodal machine learning for modeling infant head circumference, mothers’ milk composition, and their shared environment","['Machine learning', 'Paediatric research']","['Martin Becker', 'Kelsey Fehr', 'Stephanie Goguen', 'Kozeta Miliku', 'Catherine Field', 'Bianca Robertson', 'Chloe Yonemitsu', 'Lars Bode', 'Elinor Simons', 'Jean Marshall', 'Bassel Dawod', 'Piushkumar Mandhane', 'Stuart E. Turvey', 'Theo J. Moraes', 'Padmaja Subbarao', 'Natalie Rodriguez', 'Nima Aghaeepour', 'Meghan B. Azad']",2024-02-05
Machine learning approaches to evaluate infants’ general movements in the writhing stage—a pilot study,"['Neonatal brain damage', 'Predictive markers']","['Lisa Letzkus', 'J. Vince Pulido', 'Abiodun Adeyemo', 'Stephen Baek', 'Santina Zanelli']",2024-02-24
Concordance of randomised controlled trials for artificial intelligence interventions with the CONSORT-AI reporting guidelines,"['Health policy', 'Clinical trial design', 'Technology']","['Alexander P. L. Martindale', 'Benjamin Ng', 'Victoria Ngai', 'Aditya U. Kale', 'Lavinia Ferrante di Ruffano', 'Robert M. Golub', 'Gary S. Collins', 'David Moher', 'Melissa D. McCradden', 'Lauren Oakden-Rayner', 'Samantha Cruz Rivera', 'Melanie Calvert', 'Christopher J. Kelly', 'Cecilia S. Lee', 'Christopher Yau', 'An-Wen Chan', 'Pearse A. Keane', 'Andrew L. Beam', 'Alastair K. Denniston', 'Xiaoxuan Liu']",2024-02-22
Predicting mortality from AI cardiac volumes mass and coronary calcium on chest computed tomography,"['Biomarkers', 'Cardiology', 'Medical imaging']","['Robert J. H. Miller', 'Aditya Killekar', 'Aakash Shanbhag', 'Bryan Bednarski', 'Anna M. Michalowska', 'Terrence D. Ruddy', 'Andrew J. Einstein', 'David E. Newby', 'Mark Lemley', 'Konrad Pieszko', 'Serge D. Van Kriekinge', 'Paul B. Kavanagh', 'Joanna X. Liang', 'Cathleen Huang', 'Damini Dey', 'Daniel S. Berman', 'Piotr J. Slomka']",2024-03-29
Enhancing multi-UAV air combat decision making via hierarchical reinforcement learning,"['Aerospace engineering', 'Computer science', 'Information technology', 'Information theory and computation', 'Software']","['Huan Wang', 'Jintao Wang']",2024-02-23
Machine learning enhanced evaluation of semiconductor quantum dots,"['Applied physics', 'Computational science', 'Photonic devices', 'Quantum optics', 'Scientific data', 'Single photons and quantum effects', 'Quantum technology', 'Semiconductor quantum dot', 'Single photon source', 'Machine-learning-based evaluation', 'Convolutional autoencoder', 'Neural network regression']","['Emilio Corcione', 'Fabian Jakob', 'Lukas Wagner', 'Raphael Joos', 'Andre Bisquerra', 'Marcel Schmidt', 'Andreas D. Wieck', 'Arne Ludwig', 'Michael Jetter', 'Simone L. Portalupi', 'Peter Michler', 'Cristina Tarín']",2024-02-20
Assessment of area and structural irregularity of retinal layers in diabetic retinopathy using machine learning and image processing techniques,"['Diagnostic markers', 'Eye diseases']","['Hamid Riazi-Esfahani', 'Behzad Jafari', 'Hossein Azimi', 'Masoud Rahimi', 'Jamshid Saeidian', 'Parnia Pouya', 'Hooshang Faghihi', 'Arash Mirzaei', 'Esmaeil Asadi Khameneh', 'Elias Khalili Pour']",2024-02-18
Proportional impact prediction model of coating material on nitrate leaching of slow-release Urea Super Granules (USG) using machine learning and RSM technique,"['Ecology', 'Environmental impact', 'Environmental sciences']","['Sidhartha Sekhar Swain', 'Tapan Kumar Khura', 'Pramod Kumar Sahoo', 'Kapil Atmaram Chobhe', 'Nadhir Al-Ansari', 'Hari Lal Kushwaha', 'Nand Lal Kushwaha', 'Kanhu Charan Panda', 'Satish Devram Lande', 'Chandu Singh']",2024-02-06
Comparing the performance of machine learning methods in estimating the shear wave transit time in one of the reservoirs in southwest of Iran,"['Crude oil', 'Solid Earth sciences', 'Shear wave transit time', 'Shear wave velocity', 'Geomechanics', 'Machine learning']","['MohammadRasool Dehghani', 'Shahryar Jahani', 'Ali Ranjbar']",2024-02-27
Machine learning reveals features of spinon Fermi surface,"['Computational science', 'Magnetic properties and materials', 'Quantum fluids and solids', 'Quantum simulation']","['Kevin Zhang', 'Shi Feng', 'Yuri D. Lensky', 'Nandini Trivedi', 'Eun-Ah Kim']",2024-02-14
Enhancing photovoltaic parameter estimation: integration of non-linear hunting and reinforcement learning strategies with golden jackal optimizer,"['Engineering', 'Mathematics and computing']","['Chappani Sankaran Sundar Ganesh', 'Chandrasekaran Kumar', 'Manoharan Premkumar', 'Bizuwork Derebew']",2024-02-02
Mapping of soil suitability for medicinal plants using machine learning methods,"['Computational biology and bioinformatics', 'Engineering', 'Environmental social sciences', 'Health care', 'Molecular medicine', 'Plant sciences', 'Choropleth', 'Decision tree', 'Extra trees classifier', 'Geographic information system', 'Machine learning', 'Medicinal plants', 'Supervised learning']","['S. Roopashree', 'J. Anitha', 'Suryateja Challa', 'T. R. Mahesh', 'Vinoth Kumar Venkatesan', 'Suresh Guluwadi']",2024-02-14
Machine learning classification of autism spectrum disorder based on reciprocity in naturalistic social interactions,"['Autism spectrum disorders', 'Diagnostic markers', 'Psychiatric disorders']","['Jana Christina Koehler', 'Mark Sen Dong', 'Afton M. Bierlich', 'Stefanie Fischer', 'Johanna Späth', 'Irene Sophia Plank', 'Nikolaos Koutsouleris', 'Christine M. Falter-Wagner']",2024-02-03
An improved transformer-based concrete crack classification method,"['Civil engineering', 'Engineering', 'Materials science', 'Image feature extraction', 'Transformer', 'Deep learning', 'Structural health monitoring', 'Crack detection']","['Guanting Ye', 'Wei Dai', 'Jintai Tao', 'Jinsheng Qu', 'Lin Zhu', 'Qiang Jin']",2024-03-14
Machine learning enables non-Gaussian investigation of changes to peripheral nerves related to electrical stimulation,"['Computer science', 'Medical research', 'Neurology', 'Neuroscience', 'Scientific data']","['Andres W. Morales', 'Jinze Du', 'David J. Warren', 'Eduardo Fernández-Jover', 'Gema Martinez-Navarrete', 'Jean-Marie C. Bouteiller', 'Douglas C. McCreery', 'Gianluca Lazzi']",2024-02-02
A novel multi-scale CNN and Bi-LSTM arbitration dense network model for low-rate DDoS attack detection,"['Computational science', 'Computer science', 'Arbitration mechanism', 'Dense connection', 'Embedding-based bi-LSTM', 'LDDoS attacks', 'Multi-scale CNN', 'Network security']","['Xiaochun Yin', 'Wei Fang', 'Zengguang Liu', 'Deyong Liu']",2024-03-01
PhagoStat a scalable and interpretable end to end framework for efficient quantification of cell phagocytosis in neurodegenerative disease studies,"['Computational science', 'Neurodegenerative diseases', 'Scientific data', 'Software', 'Explainable artificial intelligence\xa0(XAI)', 'Deep learning\xa0(DL)', 'Interpretability', 'Scalability', 'Phase-contrast video microscopy', 'Neuro-phagocytosis', 'Neurodegenerative disease', 'Image processing']","['Mehdi Ounissi', 'Morwena Latouche', 'Daniel Racoceanu']",2024-03-18
Automated detection of Alzheimer’s disease: a multi-modal approach with 3D MRI and amyloid PET,"[""Alzheimer's disease"", 'Diagnostic markers']","['Giovanna Castellano', 'Andrea Esposito', 'Eufemia Lella', 'Graziano Montanaro', 'Gennaro Vessio']",2024-03-03
Machine learning-based detection of acute psychosocial stress from body posture and movements,"['Biomedical engineering', 'Computer science', 'Human behaviour', 'Scientific data', 'Health psychology', 'Stress', 'Cortisol', 'TSST', 'Motion capturing', 'Freezing', 'IMU', 'Machine learning']","['Robert Richer', 'Veronika Koch', 'Luca Abel', 'Felicitas Hauck', 'Miriam Kurz', 'Veronika Ringgold', 'Victoria Müller', 'Arne Küderle', 'Lena Schindler-Gmelch', 'Bjoern M. Eskofier', 'Nicolas Rohleder']",2024-04-08
Machine learning reveals differential effects of depression and anxiety on reward and punishment processing,"['Cognitive control', 'Machine learning', 'Reward', 'Depression', 'Anxiety', 'Feedback processing', 'EEG', 'Machine learning']","['Anna Grabowska', 'Jakub Zabielski', 'Magdalena Senderecka']",2024-04-10
ANTsX neuroimaging-derived structural phenotypes of UK Biobank,"['Biomarkers', 'Computational neuroscience', 'Epidemiology', 'Network models', 'Neuroscience', 'Predictive markers']","['Nicholas J. Tustison', 'Michael A. Yassa', 'Batool Rizvi', 'Philip A. Cook', 'Andrew J. Holbrook', 'Mithra T. Sathishkumar', 'Mia G. Tustison', 'James C. Gee', 'James R. Stone', 'Brian B. Avants']",2024-04-17
Communication spectrum prediction method based on convolutional gated recurrent unit network,"['Computer science', 'Information technology', 'Recurrent neural network', 'Convolutional', 'Door control unit', 'Communication spectrum', 'Prediction', 'Radio']","['Lige Yuan', 'Lulu Nie', 'Yangzhou Hao']",2024-04-18
Creating an atlas of normal tissue for pruning WSI patching through anomaly detection,"['Biomedical engineering', 'Breast cancer', 'Skin cancer']","['Peyman Nejat', 'Areej Alsaafin', 'Ghazal Alabtah', 'Nneka I. Comfere', 'Aaron R. Mangold', 'Dennis H. Murphree', 'Patricija Zot', 'Saba Yasir', 'Joaquin J. Garcia', 'H. R. Tizhoosh']",2024-02-16
Global conservation status of the jawed vertebrate Tree of Life,"['Biodiversity', 'Conservation biology', 'Macroecology', 'Phylogenetics', 'Taxonomy']","['Rikki Gumbs', 'Oenone Scott', 'Ryan Bates', 'Monika Böhm', 'Félix Forest', 'Claudia L. Gray', 'Michael Hoffmann', 'Daniel Kane', 'Christopher Low', 'William D. Pearse', 'Sebastian Pipins', 'Benjamin Tapley', 'Samuel T. Turvey', 'Walter Jetz', 'Nisha R. Owen', 'James Rosindell']",2024-02-29
Regulatory activity is the default DNA state in eukaryotes,"['Chromatin', 'Computational biology and bioinformatics', 'Epigenomics', 'Evolution']","['Ishika Luthra', 'Cassandra Jensen', 'Xinyi E. Chen', 'Asfar Lathif Salaudeen', 'Abdul Muntakim Rafi', 'Carl G. de Boer']",2024-03-06
Prioritized experience replay based on dynamics priority,"['Engineering', 'Mathematics and computing', 'Reinforcement learning', 'Experience replay', 'Soft actor-critic', 'Temporal-difference error']","['Hu Li', 'Xuezhong Qian', 'Wei Song']",2024-03-12
Determinants of efficient water use and conservation in the Colombian manufacturing industry using machine learning,"['Business and management', 'Environmental studies']","['Carolina Henao', 'Jenny Paola Lis-Gutiérrez', 'Melissa Lis-Gutiérrez', 'Janitza Ariza-Salazar']",2024-01-02
Federated clustered multi-domain learning for health monitoring,"['Engineering', 'Health care']","['Shiyi Jiang', 'Yuan Li', 'Farshad Firouzi', 'Krishnendu Chakrabarty']",2024-01-09
Dataset meta-level and statistical features affect machine learning performance,"['Applied mathematics', 'Computational science', 'Statistics']","['Shahadat Uddin', 'Haohui Lu']",2024-01-19
Improving the precision of shock resuscitation by predicting fluid responsiveness with machine learning and arterial blood pressure waveform data,"['Machine learning', 'Predictive markers', 'Predictive medicine']","['Chitrabhanu B. Gupta', 'Debraj Basu', 'Timothy K. Williams', 'Lucas P. Neff', 'Michael A. Johnson', 'Nathan T. Patel', 'Aravindh S. Ganapathy', 'Magan R. Lane', 'Fatemeh Radaei', 'Chen-Nee Chuah', 'Jason Y. Adams']",2024-01-26
Machine learning approaches for estimating interfacial tension between oil/gas and oil/water systems: a performance analysis,"['Energy science and technology', 'Engineering']","['Fatemeh Yousefmarzi', 'Ali Haratian', 'Javad Mahdavi Kalatehno', 'Mostafa Keihani Kamal']",2024-01-09
Self-driving laboratories to autonomously navigate the protein fitness landscape,"['Biotechnology', 'Protein design']","['Jacob T. Rapp', 'Bennett J. Bremer', 'Philip A. Romero']",2024-01-11
Boosting-based ensemble machine learning models for predicting unconfined compressive strength of geopolymer stabilized clayey soil,"['Civil engineering', 'Materials science']","['Gamil M. S. Abdullah', 'Mahmood Ahmad', 'Muhammad Babur', 'Muhammad Usman Badshah', 'Ramez A. Al-Mansob', 'Yaser Gamil', 'Muhammad Fawad']",2024-01-28
Explainable hybrid vision transformers and convolutional network for multimodal glioma segmentation in brain MRI,"['Biomedical engineering', 'Cancer', 'Medical imaging']","['Ramy A. Zeineldin', 'Mohamed E. Karar', 'Ziad Elshaer', 'Jan Coburger', 'Christian R. Wirtz', 'Oliver Burgert', 'Franziska Mathis-Ullrich']",2024-02-14
Development of performance and learning rate evaluation models in robot-assisted surgery using electroencephalography and eye-tracking,"['Education', 'Learning and memory', 'Visual system']","['Somayeh B. Shafiei', 'Saeed Shadpour', 'Farzan Sasangohar', 'James L. Mohler', 'Kristopher Attwood', 'Zhe Jing']",2024-01-20
Atomistic simulation assisted error-inclusive Bayesian machine learning for probabilistically unraveling the mechanical properties of solidified metals,"['Atomistic models', 'Metals and alloys']","['A. Mahata', 'T. Mukhopadhyay', 'S. Chakraborty', 'M. Asle Zaeem']",2024-01-24
Machine learning assisted exploration of the influential parameters on the PLGA nanoparticles,"['Biomedical materials', 'Pharmaceutics']","['Sima Rezvantalab', 'Sara Mihandoost', 'Masoumeh Rezaiee']",2024-01-11
Multimodal CNN-DDI: using multimodal CNN for drug to drug interaction associated events,"['Chemical biology', 'Drug discovery', 'Health care', 'Machine Learning Models', 'Neural Networks', 'Artificial Intelligence', 'Convolutional Neural Network (CNN)', 'Drugs']","['Muhammad Asfand-e-yar', 'Qadeer Hashir', 'Asghar Ali Shah', 'Hafiz Abid Mahmood Malik', 'Abdullah Alourani', 'Waqar Khalil']",2024-02-19
Dermatologist-like explainable AI enhances trust and confidence in diagnosing melanoma,"['Diagnostic markers', 'Physical examination', 'Preventive medicine']","['Tirtha Chanda', 'Katja Hauser', 'Sarah Hobelsberger', 'Tabea-Clara Bucher', 'Carina Nogueira Garcia', 'Christoph Wies', 'Harald Kittler', 'Philipp Tschandl', 'Cristian Navarrete-Dechent', 'Sebastian Podlipnik', 'Emmanouil Chousakos', 'Iva Crnaric', 'Jovana Majstorovic', 'Linda Alhajwan', 'Tanya Foreman', 'Sandra Peternel', 'Sergei Sarap', 'İrem Özdemir', 'Raymond L. Barnhill', 'Mar Llamas-Velasco', 'Gabriela Poch', 'Sören Korsing', 'Wiebke Sondermann', 'Frank Friedrich Gellrich', 'Markus V. Heppt', 'Michael Erdmann', 'Sebastian Haferkamp', 'Konstantin Drexler', 'Matthias Goebeler', 'Bastian Schilling', 'Jochen S. Utikal', 'Kamran Ghoreschi', 'Stefan Fröhling', 'Eva Krieghoff-Henning', 'Reader Study Consortium', 'Titus J. Brinker']",2024-01-15
ERCP-Net: a channel extension residual structure and adaptive channel attention mechanism for plant leaf disease classification network,"['Computer science', 'Image processing', 'Machine learning']","['Xiu Ma', 'Wei Chen', 'Yannan Xu']",2024-02-20
AI models for automated segmentation of engineered polycystic kidney tubules,"['Data mining', 'Machine learning']","['Simone Monaco', 'Nicole Bussola', 'Sara Buttò', 'Diego Sona', 'Flavio Giobergia', 'Giuseppe Jurman', 'Christodoulos Xinaris', 'Daniele Apiletti']",2024-02-03
A new approach to classifying polymer type of microplastics based on Faster-RCNN-FPN and spectroscopic imagery under ultraviolet light,"['Environmental sciences', 'Mathematics and computing', 'Ocean sciences']","['Thunchanok Thammasanya', 'Sakarat Patiam', 'Eknarin Rodcharoen', 'Ponlachart Chotikarn']",2024-02-12
A Siamese Swin-Unet for image change detection,"['Computational science', 'Computer science', 'Electrical and electronic engineering', 'Environmental impact', 'Change detection', 'Remote sensing', 'Swin transformer', 'Swin-Unet', 'Siamesenet']","['Yizhuo Tang', 'Zhengtao Cao', 'Ningbo Guo', 'Mingyong Jiang']",2024-02-25
Empirical data drift detection experiments on real-world medical imaging data,"['Computational models', 'Computational science', 'Medical imaging']","['Ali Kore', 'Elyar Abbasi Bavil', 'Vallijah Subasri', 'Moustafa Abdalla', 'Benjamin Fine', 'Elham Dolatabadi', 'Mohamed Abdalla']",2024-02-29
Rhesus infant nervous temperament predicts peri-adolescent central amygdala metabolism & behavioral inhibition measured by a machine-learning approach,"['Neuroscience', 'Psychology']","['D. Holley', 'L. J. Campos', 'C. M. Drzewiecki', 'Y. Zhang', 'J. P. Capitanio', 'A. S. Fox']",2024-03-15
End-to-end multimodal 3D imaging and machine learning workflow for non-destructive phenotyping of grapevine trunk internal structure,"['3-D reconstruction', 'Image processing', 'Imaging', 'Machine learning', 'Magnetic resonance imaging', 'Physiology', 'Plant sciences', 'X-ray tomography', '3D imaging', 'Image processing', 'MRI', 'X-ray CT', 'Plant phenotyping', 'Plant diseases', 'Trunk diseases', 'Vitis viniferaL.']","['Romain Fernandez', 'Loïc Le Cunff', 'Samuel Mérigeaud', 'Jean-Luc Verdeil', 'Julie Perry', 'Philippe Larignon', 'Anne-Sophie Spilmont', 'Philippe Chatelet', 'Maïda Cardoso', 'Christophe Goze-Bac', 'Cédric Moisy']",2024-02-29
Registered multi-device/staining histology image dataset for domain-agnostic machine learning models,"['Medical imaging', 'Pathology']","['Mieko Ochi', 'Daisuke Komura', 'Takumi Onoyama', 'Koki Shinbo', 'Haruya Endo', 'Hiroto Odaka', 'Miwako Kakiuchi', 'Hiroto Katoh', 'Tetsuo Ushiku', 'Shumpei Ishikawa']",2024-04-03
A primary sensory cortical interareal feedforward inhibitory circuit for tacto-visual integration,"['Sensory processing', 'Visual system']","['Simon Weiler', 'Vahid Rahmati', 'Marcel Isstas', 'Johann Wutke', 'Andreas Walter Stark', 'Christian Franke', 'Jürgen Graf', 'Christian Geis', 'Otto W. Witte', 'Mark Hübener', 'Jürgen Bolz', 'Troy W. Margrie', 'Knut Holthoff', 'Manuel Teichert']",2024-04-10
Optics miniaturization strategy for demanding Raman spectroscopy applications,"['Imaging and sensing', 'Raman spectroscopy']","['Oleksii Ilchenko', 'Yurii Pilhun', 'Andrii Kutsyk', 'Denys Slobodianiuk', 'Yaman Goksel', 'Elodie Dumont', 'Lukas Vaut', 'Chiara Mazzoni', 'Lidia Morelli', 'Sofus Boisen', 'Konstantinos Stergiou', 'Yaroslav Aulin', 'Tomas Rindzevicius', 'Thomas Emil Andersen', 'Mikael Lassen', 'Hemanshu Mundhada', 'Christian Bille Jendresen', 'Peter Alshede Philipsen', 'Merete Hædersdal', 'Anja Boisen']",2024-04-08
Surface defect detection of hot rolled steel based on multi-scale feature fusion and attention mechanism residual block,"['Computer science', 'Information technology', 'Mechanical engineering']","['Hongkai Zhang', 'Suqiang Li', 'Qiqi Miao', 'Ruidi Fang', 'Song Xue', 'Qianchuan Hu', 'Jie Hu', 'Sixian Chan']",2024-04-01
Discriminative functional connectivity signature of cocaine use disorder links to rTMS treatment response,"['Addiction', 'Brain imaging', 'Diagnostic markers', 'Predictive markers']","['Kanhao Zhao', 'Gregory A. Fonzo', 'Hua Xie', 'Desmond J. Oathes', 'Corey J. Keller', 'Nancy B. Carlisle', 'Amit Etkin', 'Eduardo A. Garza-Villarreal', 'Yu Zhang']",2024-02-16
Utilizing adaptive deformable convolution and position embedding for colon polyp segmentation with a visual transformer,"['Biomedical engineering', 'Engineering', 'Polyp segmentation', 'Vision transformer', 'Deformable convolution']","['Mohamed Yacin Sikkandar', 'Sankar Ganesh Sundaram', 'Ahmad Alassaf', 'Ibrahim AlMohimeed', 'Khalid Alhussaini', 'Adham Aleid', 'Salem Ali Alolayan', 'P. Ramkumar', 'Meshal Khalaf Almutairi', 'S. Sabarunisha Begum']",2024-03-27
ANN: adversarial news net for robust fake news classification,"['Computer science', 'Information technology', 'Fake news', 'Adversarial training', 'Figurative language', 'Transformers', 'FGSM', 'BERT', 'Longformer']","['Shiza Maham', 'Abdullah Tariq', 'Muhammad Usman Ghani Khan', 'Faten S. Alamri', 'Amjad Rehman', 'Tanzila Saba']",2024-04-03
Reduced progranulin increases tau and α-synuclein inclusions and alters mouse tauopathy phenotypes via glucocerebrosidase,"['Dementia', 'Molecular neuroscience', 'Protein aggregation']","['Hideyuki Takahashi', 'Sanaea Bhagwagar', 'Sarah H. Nies', 'Hongping Ye', 'Xianlin Han', 'Marius T. Chiasseu', 'Guilin Wang', 'Ian R. Mackenzie', 'Stephen M. Strittmatter']",2024-02-16
Enhancing missense variant pathogenicity prediction with protein language models using VariPred,"['Computational models', 'Machine learning', 'Protein analysis', 'Proteome informatics']","['Weining Lin', 'Jude Wells', 'Zeyuan Wang', 'Christine Orengo', 'Andrew C. R. Martin']",2024-04-07
Mosaic: in-memory computing and routing for small-world spike-based neuromorphic systems,"['Electrical and electronic engineering', 'Information technology']","['Thomas Dalgaty', 'Filippo Moro', 'Yiğit Demirağ', 'Alessio De Pra', 'Giacomo Indiveri', 'Elisa Vianello', 'Melika Payvand']",2024-01-02
Reduction in limb-movement complexity at term-equivalent age is associated with motor developmental delay in very-preterm or very-low-birth-weight infants,"['Neurological disorders', 'Paediatric research', 'Predictive markers', 'Complexity', 'General movements', 'Motor development', 'Pose estimation', 'Preterm', 'Sample entropy']","['Myung Woo Park', 'Hyung-Ik Shin', 'Moon Suk Bang', 'Don-Kyu Kim', 'Seung Han Shin', 'Ee-Kyung Kim', 'Eun Sun Lee', 'Hyun Iee Shin', 'Woo Hyung Lee']",2024-04-10
Understanding activity-stability tradeoffs in biocatalysts by enzyme proximity sequencing,"['Biocatalysis', 'Biophysical chemistry', 'Chemical engineering', 'Oxidoreductases']","['Rosario Vanella', 'Christoph Küng', 'Alexandre A. Schoepfer', 'Vanni Doffini', 'Jin Ren', 'Michael A. Nash']",2024-02-28
Automatic identification of incidents involving potential serious injuries and fatalities (PSIF),"['Computer science', 'Engineering', 'Risk assessment', 'Risk identification', 'Potential serious injuries and fatalities', 'Natural language processing']","['Pulkit Parikh', 'Julia Penfield', 'Marc Juaire']",2024-04-06
Multi-molecular hyperspectral PRM-SRS microscopy,"['Biomarkers', 'Biotechnology', 'Molecular imaging']","['Wenxu Zhang', 'Yajuan Li', 'Anthony A. Fung', 'Zhi Li', 'Hongje Jang', 'Honghao Zha', 'Xiaoping Chen', 'Fangyuan Gao', 'Jane Y. Wu', 'Huaxin Sheng', 'Junjie Yao', 'Dorota Skowronska-Krawczyk', 'Sanjay Jain', 'Lingyan Shi']",2024-02-21
Casein kinase II promotes piRNA production through direct phosphorylation of USTC component TOFU-4,['Phosphorylation'],"['Gangming Zhang', 'Chunwei Zheng', 'Yue-he Ding', 'Craig Mello']",2024-03-28
Research on the development of principles for designing elementary English speaking lessons using artificial intelligence chatbots,"['Education', 'Science, technology and society']","['Jihee Han', 'Dongyub Lee']",2024-02-05
Comparative connectomics of dauer reveals developmental plasticity,"['Network models', 'Neural circuits']","['Hyunsoo Yim', 'Daniel T. Choe', 'J. Alexander Bae', 'Myung-kyu Choi', 'Hae-Mook Kang', 'Ken C. Q. Nguyen', 'Soungyub Ahn', 'Sang-kyu Bahn', 'Heeseung Yang', 'David H. Hall', 'Jinseop S. Kim', 'Junho Lee']",2024-02-27
Mutant p53 gains oncogenic functions through a chromosomal instability-induced cytosolic DNA response,"['DNA damage and repair', 'Tumour-suppressor proteins']","['Mei Zhao', 'Tianxiao Wang', 'Frederico O. Gleber-Netto', 'Zhen Chen', 'Daniel J. McGrail', 'Javier A. Gomez', 'Wutong Ju', 'Mayur A. Gadhikar', 'Wencai Ma', 'Li Shen', 'Qi Wang', 'Ximing Tang', 'Sen Pathak', 'Maria Gabriela Raso', 'Jared K. Burks', 'Shiaw-Yih Lin', 'Jing Wang', 'Asha S. Multani', 'Curtis R. Pickering', 'Junjie Chen', 'Jeffrey N. Myers', 'Ge Zhou']",2024-01-02
Lightweight air-to-air unmanned aerial vehicle target detection model,"['Aerospace engineering', 'Imaging and sensing']","['Qing Cheng', 'Yazhe Wang', 'Wenjian He', 'Yu Bai']",2024-01-31
A novel smartphone application for early detection of habanero disease,"['Imaging', 'Plant sciences']","['Ronke Seyi Babatunde', 'Akinbowale Nathaniel Babatunde', 'Roseline Oluwaseun Ogundokun', 'Obiwusi Kolawole Yusuf', 'Peter O. Sadiku', 'Mohd Asif Shah']",2024-01-16
Realization of sextuple polarization states and interstate switching in antiferroelectric CuInP2S6,"['Ferroelectrics and multiferroics', 'Two-dimensional materials']","['Tao Li', 'Yongyi Wu', 'Guoliang Yu', 'Shengxian Li', 'Yifeng Ren', 'Yadong Liu', 'Jiarui Liu', 'Hao Feng', 'Yu Deng', 'Mingxing Chen', 'Zhenyu Zhang', 'Tai Min']",2024-03-26
